[
  {
    "@context": [
      "https://uri.etsi.org/ngsi-ld/v1/ngsi-ld-core-context.jsonld",
      "https://factory.example.com/context/assignment-context.jsonld"
    ],
    "id": "urn:ngsi-ld:Assignment:EMP-00005979:MachiningCenterOperator:SideWallShop:EarlyShift",
    "type": "Assignment",
    "assigneeId": {
      "type": "Relationship",
      "object": "urn:ngsi-ld:TwinObject:Person:EMP-00005979"
    },
    "roleId": {
      "type": "Relationship",
      "object": "urn:ngsi-ld:Role:MachiningCenterOperator"
    },
    "orgId": {
      "type": "Relationship",
      "object": "urn:ngsi-ld:OrgUnit:SideWallShop"
    },
    "validFrom": {
      "type": "Property",
      "value": "2025-11-19T08:00:00Z"
    },
    "validTo": {
      "type": "Property",
      "value": "2025-11-19T16:00:00Z"
    },
    "shiftId": {
      "type": "Property",
      "value": "EarlyShift"
    },
    "assignmentStatus": {
      "type": "Property",
      "value": "Suspended"
    },
    "notes": {
      "type": "Property",
      "value": "Generated assignment for EMP-00005979 as MachiningCenterOperator"
    }
  },
  {
    "@context": [
      "https://uri.etsi.org/ngsi-ld/v1/ngsi-ld-core-context.jsonld",
      "https://factory.example.com/context/assignment-context.jsonld"
    ],
    "id": "urn:ngsi-ld:Assignment:EMP-00005979:BodyAssembler:SideWallShop:EarlyShift",
    "type": "Assignment",
    "assigneeId": {
      "type": "Relationship",
      "object": "urn:ngsi-ld:TwinObject:Person:EMP-00005979"
    },
    "roleId": {
      "type": "Relationship",
      "object": "urn:ngsi-ld:Role:BodyAssembler"
    },
    "orgId": {
      "type": "Relationship",
      "object": "urn:ngsi-ld:OrgUnit:SideWallShop"
    },
    "validFrom": {
      "type": "Property",
      "value": "2025-11-27T08:00:00Z"
    },
    "validTo": {
      "type": "Property",
      "value": "2025-11-27T16:00:00Z"
    },
    "shiftId": {
      "type": "Property",
      "value": "EarlyShift"
    },
    "assignmentStatus": {
      "type": "Property",
      "value": "Suspended"
    },
    "notes": {
      "type": "Property",
      "value": "Generated assignment for EMP-00005979 as BodyAssembler"
    }
  },
  {
    "@context": [
      "https://uri.etsi.org/ngsi-ld/v1/ngsi-ld-core-context.jsonld",
      "https://factory.example.com/context/assignment-context.jsonld"
    ],
    "id": "urn:ngsi-ld:Assignment:EMP-00005979:DeputyPlantManager:SideWallShop:NightShift",
    "type": "Assignment",
    "assigneeId": {
      "type": "Relationship",
      "object": "urn:ngsi-ld:TwinObject:Person:EMP-00005979"
    },
    "roleId": {
      "type": "Relationship",
      "object": "urn:ngsi-ld:Role:DeputyPlantManager"
    },
    "orgId": {
      "type": "Relationship",
      "object": "urn:ngsi-ld:OrgUnit:SideWallShop"
    },
    "validFrom": {
      "type": "Property",
      "value": "2025-11-20T08:00:00Z"
    },
    "validTo": {
      "type": "Property",
      "value": "2025-11-20T16:00:00Z"
    },
    "shiftId": {
      "type": "Property",
      "value": "NightShift"
    },
    "assignmentStatus": {
      "type": "Property",
      "value": "Suspended"
    },
    "notes": {
      "type": "Property",
      "value": "Generated assignment for EMP-00005979 as DeputyPlantManager"
    }
  },
  {
    "@context": [
      "https://uri.etsi.org/ngsi-ld/v1/ngsi-ld-core-context.jsonld",
      "https://factory.example.com/context/assignment-context.jsonld"
    ],
    "id": "urn:ngsi-ld:Assignment:EMP-00006152:QuotaEngineer:SideWallShop:EarlyShift",
    "type": "Assignment",
    "assigneeId": {
      "type": "Relationship",
      "object": "urn:ngsi-ld:TwinObject:Person:EMP-00006152"
    },
    "roleId": {
      "type": "Relationship",
      "object": "urn:ngsi-ld:Role:QuotaEngineer"
    },
    "orgId": {
      "type": "Relationship",
      "object": "urn:ngsi-ld:OrgUnit:SideWallShop"
    },
    "validFrom": {
      "type": "Property",
      "value": "2025-11-01T08:00:00Z"
    },
    "validTo": {
      "type": "Property",
      "value": "2025-11-01T16:00:00Z"
    },
    "shiftId": {
      "type": "Property",
      "value": "EarlyShift"
    },
    "assignmentStatus": {
      "type": "Property",
      "value": "Active"
    },
    "notes": {
      "type": "Property",
      "value": "Generated assignment for EMP-00006152 as QuotaEngineer"
    }
  },
  {
    "@context": [
      "https://uri.etsi.org/ngsi-ld/v1/ngsi-ld-core-context.jsonld",
      "https://factory.example.com/context/assignment-context.jsonld"
    ],
    "id": "urn:ngsi-ld:Assignment:EMP-00001578:AluminumWelder:SideWallShop:NightShift",
    "type": "Assignment",
    "assigneeId": {
      "type": "Relationship",
      "object": "urn:ngsi-ld:TwinObject:Person:EMP-00001578"
    },
    "roleId": {
      "type": "Relationship",
      "object": "urn:ngsi-ld:Role:AluminumWelder"
    },
    "orgId": {
      "type": "Relationship",
      "object": "urn:ngsi-ld:OrgUnit:SideWallShop"
    },
    "validFrom": {
      "type": "Property",
      "value": "2025-11-25T08:00:00Z"
    },
    "validTo": {
      "type": "Property",
      "value": "2025-11-25T16:00:00Z"
    },
    "shiftId": {
      "type": "Property",
      "value": "NightShift"
    },
    "assignmentStatus": {
      "type": "Property",
      "value": "Expired"
    },
    "notes": {
      "type": "Property",
      "value": "Generated assignment for EMP-00001578 as AluminumWelder"
    }
  },
  {
    "@context": [
      "https://uri.etsi.org/ngsi-ld/v1/ngsi-ld-core-context.jsonld",
      "https://factory.example.com/context/assignment-context.jsonld"
    ],
    "id": "urn:ngsi-ld:Assignment:EMP-00001578:EquipmentSpecialist:SideWallShop:NightShift",
    "type": "Assignment",
    "assigneeId": {
      "type": "Relationship",
      "object": "urn:ngsi-ld:TwinObject:Person:EMP-00001578"
    },
    "roleId": {
      "type": "Relationship",
      "object": "urn:ngsi-ld:Role:EquipmentSpecialist"
    },
    "orgId": {
      "type": "Relationship",
      "object": "urn:ngsi-ld:OrgUnit:SideWallShop"
    },
    "validFrom": {
      "type": "Property",
      "value": "2025-11-25T08:00:00Z"
    },
    "validTo": {
      "type": "Property",
      "value": "2025-11-25T16:00:00Z"
    },
    "shiftId": {
      "type": "Property",
      "value": "NightShift"
    },
    "assignmentStatus": {
      "type": "Property",
      "value": "Active"
    },
    "notes": {
      "type": "Property",
      "value": "Generated assignment for EMP-00001578 as EquipmentSpecialist"
    }
  },
  {
    "@context": [
      "https://uri.etsi.org/ngsi-ld/v1/ngsi-ld-core-context.jsonld",
      "https://factory.example.com/context/assignment-context.jsonld"
    ],
    "id": "urn:ngsi-ld:Assignment:EMP-00001578:PatrolWorker:SideWallShop:EarlyShift",
    "type": "Assignment",
    "assigneeId": {
      "type": "Relationship",
      "object": "urn:ngsi-ld:TwinObject:Person:EMP-00001578"
    },
    "roleId": {
      "type": "Relationship",
      "object": "urn:ngsi-ld:Role:PatrolWorker"
    },
    "orgId": {
      "type": "Relationship",
      "object": "urn:ngsi-ld:OrgUnit:SideWallShop"
    },
    "validFrom": {
      "type": "Property",
      "value": "2025-11-23T08:00:00Z"
    },
    "validTo": {
      "type": "Property",
      "value": "2025-11-23T16:00:00Z"
    },
    "shiftId": {
      "type": "Property",
      "value": "EarlyShift"
    },
    "assignmentStatus": {
      "type": "Property",
      "value": "Suspended"
    },
    "notes": {
      "type": "Property",
      "value": "Generated assignment for EMP-00001578 as PatrolWorker"
    }
  },
  {
    "@context": [
      "https://uri.etsi.org/ngsi-ld/v1/ngsi-ld-core-context.jsonld",
      "https://factory.example.com/context/assignment-context.jsonld"
    ],
    "id": "urn:ngsi-ld:Assignment:EMP-00010936:ForkliftOperator:SideWallShop:NightShift",
    "type": "Assignment",
    "assigneeId": {
      "type": "Relationship",
      "object": "urn:ngsi-ld:TwinObject:Person:EMP-00010936"
    },
    "roleId": {
      "type": "Relationship",
      "object": "urn:ngsi-ld:Role:ForkliftOperator"
    },
    "orgId": {
      "type": "Relationship",
      "object": "urn:ngsi-ld:OrgUnit:SideWallShop"
    },
    "validFrom": {
      "type": "Property",
      "value": "2025-11-17T08:00:00Z"
    },
    "validTo": {
      "type": "Property",
      "value": "2025-11-17T16:00:00Z"
    },
    "shiftId": {
      "type": "Property",
      "value": "NightShift"
    },
    "assignmentStatus": {
      "type": "Property",
      "value": "Suspended"
    },
    "notes": {
      "type": "Property",
      "value": "Generated assignment for EMP-00010936 as ForkliftOperator"
    }
  },
  {
    "@context": [
      "https://uri.etsi.org/ngsi-ld/v1/ngsi-ld-core-context.jsonld",
      "https://factory.example.com/context/assignment-context.jsonld"
    ],
    "id": "urn:ngsi-ld:Assignment:EMP-00010936:SchedulingSupervisor:SideWallShop:EarlyShift",
    "type": "Assignment",
    "assigneeId": {
      "type": "Relationship",
      "object": "urn:ngsi-ld:TwinObject:Person:EMP-00010936"
    },
    "roleId": {
      "type": "Relationship",
      "object": "urn:ngsi-ld:Role:SchedulingSupervisor"
    },
    "orgId": {
      "type": "Relationship",
      "object": "urn:ngsi-ld:OrgUnit:SideWallShop"
    },
    "validFrom": {
      "type": "Property",
      "value": "2025-11-21T08:00:00Z"
    },
    "validTo": {
      "type": "Property",
      "value": "2025-11-21T16:00:00Z"
    },
    "shiftId": {
      "type": "Property",
      "value": "EarlyShift"
    },
    "assignmentStatus": {
      "type": "Property",
      "value": "Suspended"
    },
    "notes": {
      "type": "Property",
      "value": "Generated assignment for EMP-00010936 as SchedulingSupervisor"
    }
  },
  {
    "@context": [
      "https://uri.etsi.org/ngsi-ld/v1/ngsi-ld-core-context.jsonld",
      "https://factory.example.com/context/assignment-context.jsonld"
    ],
    "id": "urn:ngsi-ld:Assignment:EMP-00010936:MachiningCenterOperator:SideWallShop:LateShift",